{
  "schemaVersion": 1,
  "toolId": "prime-factorizer",
  "releaseId": "v0-1-4",
  "packageName": "@xpotato-tool/prime-factorizer",
  "source": {
    "kind": "github",
    "repository": "https://github.com/Xpotato1024/browser-prime-toolkit"
  },
  "sourceCommit": "835f152ec8cf0b8dca5db1f469018a1780cf5c94",
  "sourceTreeSha256": "c8bd7796c52758c816ce1df1ad0ab4ea843d928d28097a065c11485e11a035a3",
  "lockSha256": "ba2d829d78a78da3dd500b9d1ed5a8f0f485260a999c9fd0ae6d8f4dd997321c",
  "manifestSha256": "2e4e37305bf690d0bce962a4f035615c2218b7be3c3ec964b950e1dbb0f05ed9",
  "artifactSha256": "bc1030b9ae836724817e75a747e0723d313d84e0c57c84065fd496904aa4e5a1",
  "reviewSha256": "3ad31caa0be469d2d801d494e55a2fae7a118a27b7832641c128a2a7ede1b10f"
}
